{
  "$schema": "schemas/v1/protocol.schema.json",
  "protocol_id": "PRT-019a2b3c4d5e6f7a8b9c0d1e2f3a4b5c",
  "created_at": "2026-09-20T12:00:00+00:00",
  "project_slug": "identity-conformance-study",
  "playbook_type": "SCOPING_REVIEW",
  "metadata": {
    "lead_researcher": "Nexus Reviewer",
    "target_venue_type": "ACM Computing Surveys",
    "timeline_weeks": 8,
    "title": "Protocol Identity Conformance Baseline"
  },
  "epistemology": {
    "epistemological_rationale": "Empirical validation of protocol identity stability and invariant serialization.",
    "incompatible_concepts": [],
    "primary_paradigm": "Pragmatist / Mixed Methods",
    "secondary_paradigm": null,
    "trustworthiness_framework": "JBI Scoping Review Framework",
    "unit_of_analysis": "Research protocol canonical serialization"
  },
  "research_questions": [
    {
      "id": "RQ1",
      "required_evidence_type": "Empirical serialization output",
      "synthesis_type": "Comparative Matrix",
      "target_facet": "determinism",
      "text": "How do automated test suites prevent contract regressions in academic workflows?"
    }
  ],
  "search_strategy": {
    "core_concepts": [
      {
        "boolean_operator": "OR",
        "concept": "Protocol Identity",
        "synonyms": ["canonical serialization", "protocol fingerprint"]
      }
    ],
    "date_range": {
      "end_year": 2026,
      "start_year": 2020
    },
    "languages": ["en"],
    "open_access_preferred": true,
    "target_candidate_pool_size": {
      "max": 500,
      "min": 100
    },
    "target_databases": ["openalex", "semanticscholar"]
  },
  "screening_criteria": {
    "exclusion": [
      {
        "criterion": "Non-canonical or malformed protocol documents",
        "id": "EXC-01",
        "maps_to_rqs": [],
        "reason_category": "INVALID_FORMAT"
      }
    ],
    "inclusion": [
      {
        "criterion": "Formal research protocols declaring explicit research questions",
        "id": "INC-01",
        "maps_to_rqs": ["RQ1"],
        "reason_category": null
      }
    ],
    "two_tier_screening": true
  },
  "matrix_dimensions": [],
  "verification": {
    "coi_and_funding_audit_required": true,
    "minimum_trust_score_threshold": 6.0,
    "reproducibility_das_cas_check": true,
    "retraction_check_required": true
  }
}
